<?xml version="1.0" encoding="utf-8" ?>
<xs:schema
    xmlns:xs="http://www.w3.org/2001/XMLSchema"
    targetNamespace="http://www.buildamation.com"
    xmlns="http://www.buildamation.com"
    elementFormDefault="qualified">

<xs:complexType name="bam-assemblies-type">
    <xs:sequence>
        <xs:element name="BamAssembly" minOccurs="1" maxOccurs="unbounded">
            <xs:complexType>
                <xs:attribute name="name" type="xs:string" use="required" />
                <xs:attribute name="major" type="xs:positiveInteger" use="optional" />
                <xs:attribute name="minor" type="xs:nonNegativeInteger" use="optional" />
                <xs:attribute name="patch" type="xs:nonNegativeInteger" use="optional" />
            </xs:complexType>
        </xs:element>
    </xs:sequence>
</xs:complexType>

<xs:complexType name="dotnet-assemblies-type">
    <xs:sequence>
        <xs:element name="DotNetAssembly" minOccurs="1" maxOccurs="unbounded">
            <xs:complexType>
                <xs:attribute name="name" type="xs:string" use="required" />
                <xs:attribute name="requiredTargetFramework" type="xs:string" use="optional" />
            </xs:complexType>
        </xs:element>
    </xs:sequence>
</xs:complexType>

<xs:complexType name="definitions-type">
    <xs:sequence>
        <xs:element name="Definition" minOccurs="1" maxOccurs="unbounded">
            <xs:complexType>
                <xs:attribute name="name" type="xs:string" use="required" />
            </xs:complexType>
        </xs:element>
    </xs:sequence>
</xs:complexType>

<xs:simpleType name="platform-type">
  <xs:restriction base="xs:string">
    <xs:enumeration value="Windows" />
    <xs:enumeration value="Linux" />
    <xs:enumeration value="OSX" />
  </xs:restriction>
</xs:simpleType>

<xs:complexType name="supported-platforms-type">
    <xs:sequence>
        <xs:element name="Platform" minOccurs="1" maxOccurs="unbounded">
            <xs:complexType>
                <xs:attribute name="name" type="platform-type" use="required" />
            </xs:complexType>
        </xs:element>
    </xs:sequence>
</xs:complexType>

<xs:complexType name="package-repository-type">
    <xs:choice minOccurs="1" maxOccurs="unbounded">
        <xs:element name="Repo">
            <xs:complexType>
                <xs:attribute name="dir" type="xs:string" use="required" />
            </xs:complexType>
        </xs:element>
        <xs:element name="NamedRepo">
            <xs:complexType>
              <xs:attribute name="name" type="xs:string" use="required" />
            </xs:complexType>
        </xs:element>
    </xs:choice>
</xs:complexType>

<xs:attributeGroup name="package-attributes">
  <xs:attribute name="name" type="xs:string" use="required" />
  <xs:attribute name="version" type="xs:string" use="optional" />
  <xs:attribute name="default" type="xs:boolean" use="optional" />
</xs:attributeGroup>

<xs:complexType name="package-package-type">
  <xs:attributeGroup ref="package-attributes" />
</xs:complexType>

<xs:complexType name="dependents-type">
  <xs:sequence>
    <xs:element name="Package" minOccurs="1" maxOccurs="unbounded" type="package-package-type" />
  </xs:sequence>
</xs:complexType>

<xs:complexType name="nuget-packages-type">
  <xs:sequence>
    <xs:element name="NuGetPackage" minOccurs="1" maxOccurs="unbounded">
      <xs:complexType>
        <xs:sequence>
          <xs:element name="Platform" minOccurs="1" maxOccurs="unbounded">
            <xs:complexType>
              <xs:attribute name="name" type="platform-type" use="required" />
            </xs:complexType>
          </xs:element>
        </xs:sequence>
        <xs:attribute name="id" type="xs:string" use="required" />
        <xs:attribute name="version" type="xs:string" use="required" />
      </xs:complexType>
    </xs:element>
  </xs:sequence>
</xs:complexType>

<xs:simpleType name="source-valid-type">
  <xs:restriction base="xs:string">
    <xs:enumeration value="http" />
  </xs:restriction>
</xs:simpleType>

<xs:complexType name="sources-type">
  <xs:sequence>
    <xs:element name="Source" minOccurs="1" maxOccurs="unbounded">
      <xs:complexType>
        <xs:attribute name="type" type="source-valid-type" use="required" />
        <xs:attribute name="path" type="xs:anyURI" use="required" />
        <xs:attribute name="subdir" type="xs:string" use="optional" />
        <xs:attribute name="platform" type="platform-type" use="optional" />
      </xs:complexType>
    </xs:element>
  </xs:sequence>
  <xs:attribute name="extractto" type="xs:string" use="optional" />
</xs:complexType>

<!-- root node -->
<xs:element name="PackageDefinition">
    <xs:complexType>
        <xs:all>
            <xs:element name="Description" type="xs:string" minOccurs="0" maxOccurs="1" />
            <xs:element name="Dependents" type="dependents-type" minOccurs="0" maxOccurs="1" />
            <xs:element name="PackageRepositories" type="package-repository-type" minOccurs="0" maxOccurs="1" />
            <xs:element name="BamAssemblies" type="bam-assemblies-type" minOccurs="0" maxOccurs="1" />
            <xs:element name="DotNetAssemblies" type="dotnet-assemblies-type" minOccurs="0" maxOccurs="1" />
            <xs:element name="SupportedPlatforms" type="supported-platforms-type" minOccurs="0" maxOccurs="1" />
            <xs:element name="Definitions" type="definitions-type" minOccurs="0" maxOccurs="1" />
            <xs:element name="NuGetPackages" type="nuget-packages-type" minOccurs="0" maxOccurs="1" />
            <xs:element name="Sources" type="sources-type" minOccurs="0" maxOccurs="1" />
        </xs:all>
        <xs:attribute name="name" type="xs:string" use="required" />
        <xs:attribute name="version" type="xs:string" use="optional" />
    </xs:complexType>
</xs:element>
</xs:schema>
