<?xml version="1.0" encoding="utf-8"?>
<PackageDefinition xsi:schemaLocation="http://www.buildamation.com ./Schema/BamPackageDefinitionV1.xsd" name="VisualC" version="14.0" xmlns:xsi="http://www.w3.org/2001/XMLSchema-instance" xmlns="http://www.buildamation.com">
  <Description>Microsoft VisualC 2015 support (Community edition)</Description>
  <Dependents>
    <Package name="VisualCCommon" />
    <Package name="WindowsSDK" version="10" />
  </Dependents>
  <BamAssemblies>
    <BamAssembly name="Bam.Core" major="2" minor="0" patch="0" />
  </BamAssemblies>
  <DotNetAssemblies>
    <DotNetAssembly name="System" requiredTargetFramework="4.0.30319" />
    <DotNetAssembly name="System.Xml" requiredTargetFramework="4.0.30319" />
    <DotNetAssembly name="System.Core" requiredTargetFramework="4.0.30319" />
  </DotNetAssemblies>
  <SupportedPlatforms>
    <Platform name="Windows" />
    <Platform name="Linux" />
    <Platform name="OSX" />
  </SupportedPlatforms>
</PackageDefinition>
