<?xml version="1.0" encoding="utf-8"?>
<PackageDefinition xsi:schemaLocation="http://www.buildamation.com ./Schema/BamPackageDefinitionV1.xsd" name="PublishingTest2" xmlns:xsi="http://www.w3.org/2001/XMLSchema-instance" xmlns="http://www.buildamation.com">
  <Description>Publishing test, collating files that are prebuilt</Description>
  <Dependents>
    <Package name="C" />
    <Package name="MakeFileBuilder" />
    <Package name="NativeBuilder" />
    <Package name="Publisher" />
  </Dependents>
  <BamAssemblies>
    <BamAssembly name="Bam.Core" major="1" minor="2" patch="0" />
  </BamAssemblies>
  <DotNetAssemblies>
    <DotNetAssembly name="System" requiredTargetFramework="4.0.30319" />
    <DotNetAssembly name="System.Xml" requiredTargetFramework="4.0.30319" />
    <DotNetAssembly name="System.Core" requiredTargetFramework="4.0.30319" />
  </DotNetAssemblies>
  <SupportedPlatforms>
    <Platform name="Windows" />
    <Platform name="Linux" />
    <Platform name="OSX" />
  </SupportedPlatforms>
</PackageDefinition>
