<?xml version="1.0" encoding="utf-8"?>
<PackageDefinition xsi:schemaLocation="http://www.buildamation.com ./Schema/BamPackageDefinitionV1.xsd" name="Clang" version="Xcode5" xmlns:xsi="http://www.w3.org/2001/XMLSchema-instance" xmlns="http://www.buildamation.com">
  <Description>Clang support for Xcode5, SDK 10.8 and 10.9</Description>
  <Dependents>
    <Package name="ClangCommon" />
    <Package name="XcodeBuilder" />
  </Dependents>
  <BamAssemblies>
    <BamAssembly name="Bam.Core" major="2" minor="0" patch="0" />
  </BamAssemblies>
  <DotNetAssemblies>
    <DotNetAssembly name="System" requiredTargetFramework="4.0.30319" />
    <DotNetAssembly name="System.Xml" requiredTargetFramework="4.0.30319" />
    <DotNetAssembly name="System.Core" requiredTargetFramework="4.0.30319" />
  </DotNetAssemblies>
  <SupportedPlatforms>
    <Platform name="Windows" />
    <Platform name="Linux" />
    <Platform name="OSX" />
  </SupportedPlatforms>
</PackageDefinition>
