<?xml version="1.0" encoding="utf-8"?>
<PackageDefinition xsi:schemaLocation="http://www.buildamation.com ./Schema/BamPackageDefinitionV1.xsd" name="UnicodeTest1" xmlns:xsi="http://www.w3.org/2001/XMLSchema-instance" xmlns="http://www.buildamation.com">
  <Description>Exercising unicode builds</Description>
  <Dependents>
    <Package name="C" />
    <Package name="MakeFileBuilder" />
    <Package name="Mingw" version="4.8.1" />
    <Package name="NativeBuilder" />
    <Package name="VisualC" version="10.0" />
    <Package name="VisualC" version="11.0" />
    <Package name="VisualC" version="12.0" default="true" />
    <Package name="VisualC" version="14.0" />
    <Package name="VisualC" version="15.0" />
    <Package name="VisualC" version="16" />
    <Package name="VSSolutionBuilder" />
  </Dependents>
  <BamAssemblies>
    <BamAssembly name="Bam.Core" major="2" minor="0" patch="0" />
  </BamAssemblies>
  <DotNetAssemblies>
    <DotNetAssembly name="System" requiredTargetFramework="4.0.30319" />
    <DotNetAssembly name="System.Xml" requiredTargetFramework="4.0.30319" />
    <DotNetAssembly name="System.Core" requiredTargetFramework="4.0.30319" />
  </DotNetAssemblies>
  <SupportedPlatforms>
    <Platform name="Windows" />
  </SupportedPlatforms>
</PackageDefinition>
