<?xml version="1.0" encoding="utf-8"?>
<PackageDefinition name="OpenCLTest1" xsi:schemaLocation="http://www.buildamation.com ./Schema/BamPackageDefinitionV1.xsd" xmlns:xsi="http://www.w3.org/2001/XMLSchema-instance" xmlns="http://www.buildamation.com">
  <Dependents>
    <Package name="AMDAPPSDK" version="2.9" />
    <Package name="C" />
    <Package name="Clang" version="3.1" />
    <Package name="LLVMGcc" version="4.2" />
    <Package name="MakeFileBuilder" />
    <Package name="NativeBuilder" />
    <Package name="Publisher" />
    <Package name="VisualC" version="12.0" />
    <Package name="VSSolutionBuilder" />
    <Package name="WindowsSDK" version="8.1" />
    <Package name="XcodeBuilder" />
  </Dependents>
  <BamAssemblies>
    <BamAssembly name="Bam.Core" />
  </BamAssemblies>
  <DotNetAssemblies>
    <DotNetAssembly name="System" requiredTargetFramework="4.0.30319" />
    <DotNetAssembly name="System.Xml" requiredTargetFramework="4.0.30319" />
    <DotNetAssembly name="System.Core" requiredTargetFramework="4.0.30319" />
  </DotNetAssemblies>
  <SupportedPlatforms>
    <Platform name="Windows" />
    <Platform name="Linux" />
    <Platform name="OSX" />
  </SupportedPlatforms>
  <Definitions>
    <Definition name="USINGAMD" />
  </Definitions>
</PackageDefinition>
