<?xml version="1.0" encoding="utf-8"?>
<PackageDefinition xsi:schemaLocation="http://www.buildamation.com ./Schema/BamPackageDefinitionV1.xsd" name="C" xmlns:xsi="http://www.w3.org/2001/XMLSchema-instance" xmlns="http://www.buildamation.com">
  <Description>Compilers, linkers, archivers, applications, dynamic and static libraries - all for C, C++, ObjectiveC and ObjectiveC++.</Description>
  <Dependents>
    <Package name="CommandLineProcessor" />
  </Dependents>
  <BamAssemblies>
    <BamAssembly name="Bam.Core" major="2" minor="0" patch="0" />
  </BamAssemblies>
  <DotNetAssemblies>
    <DotNetAssembly name="System" requiredTargetFramework="4.0.30319" />
    <DotNetAssembly name="System.Xml" requiredTargetFramework="4.0.30319" />
    <DotNetAssembly name="System.Core" requiredTargetFramework="4.0.30319" />
  </DotNetAssemblies>
  <NuGetPackages>
    <NuGetPackage id="Mono.Posix.NETStandard" version="1.0.0">
      <Platform name="Linux" />
    </NuGetPackage>
  </NuGetPackages>
  <SupportedPlatforms>
    <Platform name="Windows" />
    <Platform name="Linux" />
    <Platform name="OSX" />
  </SupportedPlatforms>
</PackageDefinition>
