<?xml version="1.0" encoding="utf-8"?>
<PackageDefinition xsi:schemaLocation="http://www.buildamation.com ./Schema/BamPackageDefinitionV1.xsd" name="VersionScriptTest1" xmlns:xsi="http://www.w3.org/2001/XMLSchema-instance" xmlns="http://www.buildamation.com">
  <Description>Use a version script to limit API exposure</Description>
  <Dependents>
    <Package name="C" />
    <Package name="Gcc" version="4.8" default="true" />
    <Package name="Gcc" version="5" />
    <Package name="Gcc" version="7" />
    <Package name="Gcc" version="8" />
    <Package name="Gcc" version="9" />
    <Package name="MakeFileBuilder" />
    <Package name="NativeBuilder" />
    <Package name="Publisher" />
  </Dependents>
  <BamAssemblies>
    <BamAssembly name="Bam.Core" major="2" minor="0" patch="0" />
  </BamAssemblies>
  <DotNetAssemblies>
    <DotNetAssembly name="System" requiredTargetFramework="4.0.30319" />
    <DotNetAssembly name="System.Xml" requiredTargetFramework="4.0.30319" />
    <DotNetAssembly name="System.Core" requiredTargetFramework="4.0.30319" />
  </DotNetAssemblies>
  <SupportedPlatforms>
    <Platform name="Linux" />
  </SupportedPlatforms>
</PackageDefinition>
